{
  "id": "T-factor-8000001-9000000",
  "table": "factor",
  "range_start": 8000001,
  "range_end": 9000000,
  "columns": [
    "prime_factors",
    "smallest_prime_factor",
    "largest_prime_factor",
    "radical",
    "omega_distinct",
    "omega_big",
    "euler_phi",
    "mobius",
    "liouville_lambda",
    "von_mangoldt",
    "is_prime",
    "is_prime_power",
    "is_squarefree",
    "is_powerful",
    "divisor_count",
    "divisor_sum",
    "aliquot_sum",
    "abundancy_index",
    "abundance_class",
    "is_perfect",
    "is_practical",
    "carmichael_lambda",
    "gcd_sum_pillai",
    "sum_of_two_squares_count"
  ],
  "algorithm_release": "",
  "expected_row_count": 1000000
}
